ID,Title,Author(s),Source,Journal,Language(s),Publication year,Fulltext URL 
"S0104-83332014000100201-scl","Diferenças e desigualdades negociadas: raça, sexualidade e gênero em produções acadêmicas recentes","Moutinho, Laura","Cadernos Pagu; (42); 201-248","Cadernos Pagu","Português","2014","http://www.scielo.br/scielo.php?script=sci_arttext&pid=S0104-83332014000100201&lang=pt" 
"S0103-37862014000100004-scl","Elements of social representation theory incollaborative tagging systems","Marchiori, Patricia Zeni, Appel, Andre Luiz, Bettoni, Eduardo Michellotti, Tsunoda, Denise Fukumi, Alcântara, Frank Coelho de","Transinformação; 26(1); 27-37","Transinformação","Inglês","2014","http://www.scielo.br/scielo.php?script=sci_arttext&pid=S0103-37862014000100004&lang=pt" 
"S0104-12902014000100042-scl","Pedrinho, religiosidade e prostituição: os agenciamentos de um ser ambivalente","Bardi, Giovanna, Malfitano, Ana Paula Serrata","Saúde e Sociedade; 23(1); 42-53","Saúde e Sociedade","Inglês, Português","2014","http://www.scielo.br/scielo.php?script=sci_arttext&pid=S0104-12902014000100042&lang=pt" 
"S1413-294X2014000100007-scl","Funções do agente comunitário de saúde no trabalho com redes sociais","Pinheiro, Ricardo Lana, Guanaes-Lorenzi, Carla","Estudos de Psicologia (Natal); 19(1); 48-57","Estudos de Psicologia (Natal)","Português","2014","http://www.scielo.br/scielo.php?script=sci_arttext&pid=S1413-294X2014000100007&lang=pt" 
"S1414-40772014000100014-scl","Avaliação de redes de pesquisa e colaboração","Leite, Denise, Caregnato, Célia Elizabete, Lima, Elizeth Gonzaga dos Santos, Pinho, Isabel, Miorando, Bernardo Sfredo, Silveira, Priscila Bier da","Avaliação: Revista da Avaliação da Educação Superior (Campinas); 19(1); 291-312","Avaliação: Revista da Avaliação da Educação Superior (Campinas)","Português","2014","http://www.scielo.br/scielo.php?script=sci_arttext&pid=S1414-40772014000100014&lang=pt" 
"S1678-69712014000100009-scl","Agência e redes mundos pequenos: uma análise multinível da produtividade acadêmica","Rossoni, Luciano","RAM. Revista de Administração Mackenzie; 15(1); 200-235","RAM. Revista de Administração Mackenzie","Português","2014","http://www.scielo.br/scielo.php?script=sci_arttext&pid=S1678-69712014000100009&lang=pt" 
"S1413-23112013000300009-scl","Posicionamento estratégico de MPE&#039;S com base na inovação através do modelo Hélice Tríplice","Schreiber, Dusan, Bessi, Vânia Gisele, Puffal, Daniel Pedro, Tondolo, Vilmar Antônio Gonçalves","REAd. Revista Eletrônica de Administração (Porto Alegre); 19(3); 767-795","REAd. Revista Eletrônica de Administração (Porto Alegre)","Português","2013","http://www.scielo.br/scielo.php?script=sci_arttext&pid=S1413-23112013000300009&lang=pt" 
"S1413-294X2013000400012-scl","Rede de apoio social de pacientes com diagnóstico de esquizofrenia: estudo exploratório","Macêdo, Tereza Efigênia Pessoa Morano, Fernandes, Cibelle Antunes, Costa, Ileno Silva da","Estudos de Psicologia (Natal); 18(4); 639-647","Estudos de Psicologia (Natal)","Português","2013","http://www.scielo.br/scielo.php?script=sci_arttext&pid=S1413-294X2013000400012&lang=pt" 
"S0103-37862013000300007-scl","Redes sociais de dois modos: aspectos conceituais","Tomaél, Maria Inês, Marteleto, Regina Maria","Transinformação; 25(3); 245-253","Transinformação","Português","2013","http://www.scielo.br/scielo.php?script=sci_arttext&pid=S0103-37862013000300007&lang=pt" 
"S1809-58442013000200013-scl","Apontamentos sobre o crescimento do Carnaval de rua no Rio de Janeiro no início do século 21","Herschmann, Micael","Intercom: Revista Brasileira de Ciências da Comunicação; 36(2); 267-289","Intercom: Revista Brasileira de Ciências da Comunicação","Português","2013","http://www.scielo.br/scielo.php?script=sci_arttext&pid=S1809-58442013000200013&lang=pt" 
"S1415-65552013000600007-scl","Rede de pesquisadores de finanças no Brasil: um mundo pequeno feito por poucos","Mendes-da-Silva, Wesley, Onusic, Luciana Massaro, Giglio, Ernesto Michelangelo","Revista de Administração Contemporânea; 17(6); 739-763","Revista de Administração Contemporânea","Português","2013","http://www.scielo.br/scielo.php?script=sci_arttext&pid=S1415-65552013000600007&lang=pt" 
"S1984-02922013000300015-scl","Novas tecnologias de vigilância e a gestão de violências","Bonamigo, Irme Salete","Fractal: Revista de Psicologia; 25(3); 659-674","Fractal: Revista de Psicologia","Português","2013","http://www.scielo.br/scielo.php?script=sci_arttext&pid=S1984-02922013000300015&lang=pt" 
"S1809-98232013000400821-scl","Grupos de convivência como suporte ao idoso na melhoria da saúde","Wichmann, Francisca Maria Assmann, Couto, Analie Nunes, Areosa, Silvia Virgínia Coutinho, Montañés, Maria Concepción Menéndez","Revista Brasileira de Geriatria e Gerontologia; 16(4); 821-832","Revista Brasileira de Geriatria e Gerontologia","Português","2013","http://www.scielo.br/scielo.php?script=sci_arttext&pid=S1809-98232013000400821&lang=pt" 
"S0102-69092013000300012-scl","Análise de redes sociais, classes sociais e marxismo","Minella, Ary Cesar","Revista Brasileira de Ciências Sociais; 28(83); 185-194","Revista Brasileira de Ciências Sociais","Português","2013","http://www.scielo.br/scielo.php?script=sci_arttext&pid=S0102-69092013000300012&lang=pt" 
"S1413-99362013000300006-scl","Impactos dos nomes nas propriedades de redes sociais: um estudo em rede de coautoria sobre sustentabilidade","Barbastefano, Rafael Garcia, Souza, Cristina, Costa, Juliana de Sousa, Teixeira, Patrícia Mattos","Perspectivas em Ciência da Informação; 18(3); 78-95","Perspectivas em Ciência da Informação","Português","2013","http://www.scielo.br/scielo.php?script=sci_arttext&pid=S1413-99362013000300006&lang=pt" 
"S1414-40772013000200009-scl","Tecnologias da informação e comunicação no ensino: um estudo bibliométrico e sociométrico de 1997-2011","Bach, Tatiana Marceda, Domingues, Maria José Carvalho de Souza, Walter, Silvana Anita","Avaliação: Revista da Avaliação da Educação Superior (Campinas); 18(2); 393-416","Avaliação: Revista da Avaliação da Educação Superior (Campinas)","Português","2013","http://www.scielo.br/scielo.php?script=sci_arttext&pid=S1414-40772013000200009&lang=pt" 
"S1415-65552013000300006-scl","Characteristics and performance of knowledge networks in the biotechnology sector","Machado, Diego de Queiroz, Ipiranga, Ana Silvia Rocha","Revista de Administração Contemporânea; 17(3); 350-367","Revista de Administração Contemporânea","Inglês","2013","http://www.scielo.br/scielo.php?script=sci_arttext&pid=S1415-65552013000300006&lang=pt" 
"S0102-69922013000100008-scl","Ecologia política e processos de territorialização","Miranda, Roberto de Sousa","Sociedade e Estado; 28(1); 142-161","Sociedade e Estado","Português","2013","http://www.scielo.br/scielo.php?script=sci_arttext&pid=S0102-69922013000100008&lang=pt" 
"S1413-23112013000100007-scl","Inserção de pesquisadores entrantes na área de estratégia: análise das relações de autoria e temas estudados no período de 1997-2010","Walter, Silvana Anita, Bach, Tatiana Marceda","REAd. Revista Eletrônica de Administração (Porto Alegre); 19(1); 165-191","REAd. Revista Eletrônica de Administração (Porto Alegre)","Português","2013","http://www.scielo.br/scielo.php?script=sci_arttext&pid=S1413-23112013000100007&lang=pt" 
"S1413-73722013000100012-scl","Fontes de apoio social a idosos portadores de doença pulmonar obstrutiva crônica","Andrade, Danyelle Almeida de, Eulálio, Maria do Carmo, Melo, Rômulo Lustosa Pimenteira de","Psicologia em Estudo; 18(1); 115-123","Psicologia em Estudo","Português","2013","http://www.scielo.br/scielo.php?script=sci_arttext&pid=S1413-73722013000100012&lang=pt" 
"S1984-92302013000100006-scl","Classificação dos laços entre gestores e Stakeholders na rede dos pontos de cultura no grande Recife","Melo, Paulo Thiago Nunes Bezerra de, Régis, Helder Pontes","Organizações &amp; Sociedade; 20(64); 75-96","Organizações &amp; Sociedade","Português","2013","http://www.scielo.br/scielo.php?script=sci_arttext&pid=S1984-92302013000100006&lang=pt" 
"S0102-79722013000300016-scl","Redes sociais significativas de mulheres com transtornos alimentares","Leonidas, Carolina, Santos, Manoel Antônio dos","Psicologia: Reflexão e Crítica; 26(3); 561-571","Psicologia: Reflexão e Crítica","Português","2013","http://www.scielo.br/scielo.php?script=sci_arttext&pid=S0102-79722013000300016&lang=pt" 
"S2237-101X2012000200168-scl","A carreira transimperial de don Manuel Cipriano de Melo no rio da Prata do século XVIII","Prado, Fabrício","Topoi (Rio de Janeiro); 13(25); 168-174","Topoi (Rio de Janeiro)","Português","2012","http://www.scielo.br/scielo.php?script=sci_arttext&pid=S2237-101X2012000200168&lang=pt" 
"S0102-01882012000200003-scl","Espaços industriais e comunidades operárias: o caso de estudo português e a tradição historiográfica europeia","Pereira, Joana Vidal de Azevedo Dias","Revista Brasileira de História; 32(64); 27-44","Revista Brasileira de História","Inglês, Português","2012","http://www.scielo.br/scielo.php?script=sci_arttext&pid=S0102-01882012000200003&lang=pt" 
"S0103-20702012000200012-scl","&quot;Raça&quot; e pobreza em contextos metropolitanos","Lima, Márcia","Tempo Social; 24(2); 233-254","Tempo Social","Português","2012","http://www.scielo.br/scielo.php?script=sci_arttext&pid=S0103-20702012000200012&lang=pt" 
"S1413-99362012000300009-scl","Preconceito social na Internet: a reprodução de preconceitos e desigualdades sociais a partir da análise de sites de redes sociais","Cruz, Ruleandson do Carmo","Perspectivas em Ciência da Informação; 17(3); 121-136","Perspectivas em Ciência da Informação","Português","2012","http://www.scielo.br/scielo.php?script=sci_arttext&pid=S1413-99362012000300009&lang=pt" 
"S0103-20032012000300009-scl","O consumo de queijo como referência para a análise do mercado de qualidade do produto","Chalita, Marie Anne Najm","Revista de Economia e Sociologia Rural; 50(3); 545-562","Revista de Economia e Sociologia Rural","Português","2012","http://www.scielo.br/scielo.php?script=sci_arttext&pid=S0103-20032012000300009&lang=pt" 
"S0080-21072012000300008-scl","The generation and re-generation of social capital and enterprises in multi-stakeholders social cooperative enterprises: a system dynamic approach","Travaglini, Claudio","Revista de Administração (São Paulo); 47(3); 436-445","Revista de Administração (São Paulo)","Inglês","2012","http://www.scielo.br/scielo.php?script=sci_arttext&pid=S0080-21072012000300008&lang=pt" 
"S0104-93132012000200001-scl","Sobre o cuidado de outros em contextos de pobreza, uso de drogas e marginalização","Epele, María","Mana; 18(2); 247-268","Mana","Português","2012","http://www.scielo.br/scielo.php?script=sci_arttext&pid=S0104-93132012000200001&lang=pt" 
"S0034-76122012000400007-scl","Modelo de ciclo de vida de empreendimentos sociais","Vasconcelos, Alexandre Meira de, Lezana, Álvaro Guillermo Rojas","Revista de Administração Pública; 46(4); 1037-1058","Revista de Administração Pública","Português","2012","http://www.scielo.br/scielo.php?script=sci_arttext&pid=S0034-76122012000400007&lang=pt" 
"S1678-69712012000400009-scl","Uma reflexão sobre as relações de parceria nos APLs de Confecções do Agreste Pernambucano como elemento disseminador da inovação em redes interorganizacionais","Silva, Fabiana Ferreira, Feitosa, Marcos Gilson Gomes, Aguiar, Virgínia do Socorro Motta","RAM. Revista de Administração Mackenzie; 13(4); 206-235","RAM. Revista de Administração Mackenzie","Português","2012","http://www.scielo.br/scielo.php?script=sci_arttext&pid=S1678-69712012000400009&lang=pt" 
"S1981-81222012000200009-scl","A Lei de Sementes brasileira e os seus impactos sobre a agrobiodiversidade e os sistemas agrícolas locais e tradicionais","Santilli, Juliana","Boletim do Museu Paraense Emílio Goeldi. Ciências Humanas; 7(2); 457-475","Boletim do Museu Paraense Emílio Goeldi. Ciências Humanas","Português","2012","http://www.scielo.br/scielo.php?script=sci_arttext&pid=S1981-81222012000200009&lang=pt" 
"S0104-87752012000100013-scl","Fortunas e infortúnios ultramarinos: alguns casos de enriquecimento e conflitos políticos de governadores na América portuguesa","Pereira, Marcos Aurélio de Paula","Varia Historia; 28(47); 279-300","Varia Historia","Português","2012","http://www.scielo.br/scielo.php?script=sci_arttext&pid=S0104-87752012000100013&lang=pt" 
"S0103-73312012000200021-scl","Drogas em áreas de risco: o que dizem os jovens","Costa, Anacely Guimarães, Camurça, Valeska Vieira, Braga, Juliana Martins, Tatmatsu, Daniely Ildegardes Brito","Physis: Revista de Saúde Coletiva; 22(2); 803-819","Physis: Revista de Saúde Coletiva","Português","2012","http://www.scielo.br/scielo.php?script=sci_arttext&pid=S0103-73312012000200021&lang=pt" 
"S1984-92302012000200005-scl","Sensemaking e o desenvolvimento de redes de relacionamentos de negócios no contexto das empresas de base tecnológica","Mello, Sergio Carvalho Benício de, Fonseca, Francisco Ricardo Bezerra, Vieira, Ricardo Sérgio Gomes","Organizações &amp; Sociedade; 19(61); 253-275","Organizações &amp; Sociedade","Português","2012","http://www.scielo.br/scielo.php?script=sci_arttext&pid=S1984-92302012000200005&lang=pt" 
"S0103-166X2012000200005-scl","Família e projetos sociais voltados para jovens: impacto e participação","Feijó, Marianne Ramos, Macedo, Rosa Maria Stefanini de","Estudos de Psicologia (Campinas); 29(2); 193-202","Estudos de Psicologia (Campinas)","Português","2012","http://www.scielo.br/scielo.php?script=sci_arttext&pid=S0103-166X2012000200005&lang=pt" 
"S0102-71822012000100012-scl","Violência contra pessoa idosa: representações sociais entre adolescentes do arquipélago de Fernando de Noronha-PE","Araújo, Ludgleydson Fernandes de, Amaral, Edna de Brito, Sá, Elba Celestina do Nascimento, Azevedo, Regina Ligia W. de, Lobo Filho, Jorgeano Gregório","Psicologia &amp; Sociedade; 24(1); 104-111","Psicologia &amp; Sociedade","Português","2012","http://www.scielo.br/scielo.php?script=sci_arttext&pid=S0102-71822012000100012&lang=pt" 
"S0034-75902012000200008-scl","&quot;Segurando na mão de Deus&quot;: organizações religiosas e apoio ao empreendedorismo","Serafim, Mauricio Custódio, Martes, Ana Cristina Braga, Rodriguez, Carlos L.","Revista de Administração de Empresas; 52(2); 217-231","Revista de Administração de Empresas","Português","2012","http://www.scielo.br/scielo.php?script=sci_arttext&pid=S0034-75902012000200008&lang=pt" 
"S1806-48922012000100078-scl","Discussões sobre a Metodologia de Pesquisa sobre Redes de Negócios Presentes numa Amostra de Produção Científica Brasileira e Proposta de um Modelo Orientador","Giglio, Ernesto Michelangelo, Hernandes, José Luis Guagliardi","Revista Brasileira de Gestão de Negócios; 14(42); 78-101","Revista Brasileira de Gestão de Negócios","Português","2012","http://www.scielo.br/scielo.php?script=sci_arttext&pid=S1806-48922012000100078&lang=pt" 
"S0034-76122012000100014-scl","A blockmodel study of managerial hierarchies, verbal networks, and organizational culture in four hospitals","Nelson, Reed Elliot","Revista de Administração Pública; 46(1); 291-314","Revista de Administração Pública","Inglês","2012","http://www.scielo.br/scielo.php?script=sci_arttext&pid=S0034-76122012000100014&lang=pt" 
"S1808-24322011000200004-scl","Discursos de ódio em redes sociais: jurisprudência brasileira","Silva, Rosane Leal da, Nichel, Andressa, Martins, Anna Clara Lehmann, Borchardt, Carlise Kolbe","Revista Direito GV; 7(2); 445-468","Revista Direito GV","Português","2011","http://www.scielo.br/scielo.php?script=sci_arttext&pid=S1808-24322011000200004&lang=pt" 
"S1679-39512011000400003-scl","As redes sociais dos empreendedores na formação do capital social: um estudo de casos múltiplos em municípios do norte pioneiro no estado do Paraná","Ducci, Norma Pimenta Cirilo, Teixeira, Rivanda Meira","Cadernos EBAPE.BR; 9(4); 967-997","Cadernos EBAPE.BR","Português","2011","http://www.scielo.br/scielo.php?script=sci_arttext&pid=S1679-39512011000400003&lang=pt" 
"S0080-21072011000400002-scl","Inovatividade organizacional e seus antecedentes: um estudo aplicado às tecnologias para pecuária","Ribeiro, Eneida Bezerra Soares, Korelo, José Carlos, Silva, Danielle Mantovani Lucena da, Prado, Paulo Henrique Muller","Revista de Administração (São Paulo); 46(4); 342-357","Revista de Administração (São Paulo)","Português","2011","http://www.scielo.br/scielo.php?script=sci_arttext&pid=S0080-21072011000400002&lang=pt" 
"S1809-58442011000200010-scl","Las nuevas tecnologías de información y comunicación y las políticas culturales en México : Ingeniería en Comunicación Social del servicio de redes sociales Facebook","Galindo Cáceres, Jesús","Intercom: Revista Brasileira de Ciências da Comunicação; 34(2); 175-196","Intercom: Revista Brasileira de Ciências da Comunicação","Espanhol","2011","http://www.scielo.br/scielo.php?script=sci_arttext&pid=S1809-58442011000200010&lang=pt" 
"S1413-99362011000300013-scl","Redes Sociais de Informação: uma história e um estudo de caso","Ferreira, Gonçalo Costa","Perspectivas em Ciência da Informação; 16(3); 208-231","Perspectivas em Ciência da Informação","Português","2011","http://www.scielo.br/scielo.php?script=sci_arttext&pid=S1413-99362011000300013&lang=pt" 
"S0102-71822011000200009-scl","Redes sociais interorganizacionais na efetivação de projetos sociais","Ribeiro, Elisa Maria Barbosa de Amorim, Bastos, Antônio Virgílio Bittencourt","Psicologia &amp; Sociedade; 23(2); 282-292","Psicologia &amp; Sociedade","Português","2011","http://www.scielo.br/scielo.php?script=sci_arttext&pid=S0102-71822011000200009&lang=pt" 
"S1984-92302011000200001-scl","Proposta de um quadro de referência para integrar o consumidor nos conceitos de redes","Giglio, Ernesto Michelangelo","Organizações &amp; Sociedade; 18(57); 207-226","Organizações &amp; Sociedade","Português","2011","http://www.scielo.br/scielo.php?script=sci_arttext&pid=S1984-92302011000200001&lang=pt" 
"S0104-71832011000100006-scl","&quot;O homem é mesmo a sua testosterona&quot;: promoção da andropausa e representações sobre sexualidade e envelhecimento no cenário brasileiro","Rohden, Fabíola","Horizontes Antropológicos; 17(35); 161-196","Horizontes Antropológicos","Português","2011","http://www.scielo.br/scielo.php?script=sci_arttext&pid=S0104-71832011000100006&lang=pt" 
"S0104-44782011000200011-scl","Contribuições da análise de redes sociais às teorias de movimentos sociais","Carlos, Euzeneia","Revista de Sociologia e Política; 19(39); 153-166","Revista de Sociologia e Política","Português","2011","http://www.scielo.br/scielo.php?script=sci_arttext&pid=S0104-44782011000200011&lang=pt" 
"S0034-75902011000300008-scl","RAE-eletrônica: exploração do acervo à luz da bibliometria, geoanálise e redes sociais","Francisco, Eduardo de Rezende","Revista de Administração de Empresas; 51(3); 280-306","Revista de Administração de Empresas","Português","2011","http://www.scielo.br/scielo.php?script=sci_arttext&pid=S0034-75902011000300008&lang=pt" 
"S1414-49802011000100013-scl","Modelos de políticas públicas de Colombia, en beneficio de las familias","Quintero Velásquez, Ángela María","Revista Katálysis; 14(1); 116-125","Revista Katálysis","Espanhol","2011","http://www.scielo.br/scielo.php?script=sci_arttext&pid=S1414-49802011000100013&lang=pt" 
"S0100-19652011000100003-scl","Coautoria na produção científica do PPGGeo/UFRGS: uma análise de redes sociais","Lima, Maycke Young de","Ciência da Informação; 40(1); 38-51","Ciência da Informação","Português","2011","http://www.scielo.br/scielo.php?script=sci_arttext&pid=S0100-19652011000100003&lang=pt" 
"S0104-12902011000100022-scl","Redes sociais e comportamento sexual: para uma visão relacional da sexualidade, do risco e da prevenção","Aboim, Sofia","Saúde e Sociedade; 20(1); 207-224","Saúde e Sociedade","Português","2011","http://www.scielo.br/scielo.php?script=sci_arttext&pid=S0104-12902011000100022&lang=pt" 
"S1415-65552011000100004-scl","Redes sociais na produção científica dos programas de pós-graduação de ciências contábeis do Brasil","Nascimento, Sabrina do, Beuren, Ilse Maria","Revista de Administração Contemporânea; 15(1); 47-66","Revista de Administração Contemporânea","Português","2011","http://www.scielo.br/scielo.php?script=sci_arttext&pid=S1415-65552011000100004&lang=pt" 
"S1516-73132011000200007-scl","Representações sobre meio ambiente de alunos da Educação Básica de Palmas (TO)","Aires, Berenice Feitosa da Costa, Bastos, Rogério Pereira","Ciência &amp; Educação (Bauru); 17(2); 353-364","Ciência &amp; Educação (Bauru)","Português","2011","http://www.scielo.br/scielo.php?script=sci_arttext&pid=S1516-73132011000200007&lang=pt" 
"S1413-77042011000100011-scl","Barões numa perspectiva reticular: análise de redes sociais, poder e nobreza na Zona da Mata Mineira no segundo Reinado","Genovez, Patrícia Falco","Tempo; 16(30); 243-266","Tempo","Português","2011","http://www.scielo.br/scielo.php?script=sci_arttext&pid=S1413-77042011000100011&lang=pt" 
"S0103-37862010000300006-scl","Redes sociais virtuais: premissas teóricas ao estudo em ciência da informação","Cruz, Ruleandson do Carmo","Transinformação; 22(3); 255-272","Transinformação","Português","2010","http://www.scielo.br/scielo.php?script=sci_arttext&pid=S0103-37862010000300006&lang=pt" 
"S1414-32832010000400016-scl","Implicações de redes temáticas em blogs na Análise de Redes Sociais (ARS): estudo de caso de blogs sobre autismo e síndrome de Asperger","Montardo, Sandra Portella, Passerino, Liliana Maria","Interface - Comunicação, Saúde, Educação; 14(35); 921-931","Interface - Comunicação, Saúde, Educação","Português","2010","http://www.scielo.br/scielo.php?script=sci_arttext&pid=S1414-32832010000400016&lang=pt" 
"S0104-12902010000400010-scl","Análise das redes interpessoais: aplicação na realidade de uma equipe de enfermagem atuando em unidade de hematologia","Landim, Fátima Luna Pinheiro, Fernandes, Andreia Morais, Mesquita, Rafael Barreto de, Collares, Patrícia Moreira Costa, Frota, Mirna Albuquerque","Saúde e Sociedade; 19(4); 828-837","Saúde e Sociedade","Português","2010","http://www.scielo.br/scielo.php?script=sci_arttext&pid=S0104-12902010000400010&lang=pt" 
"S0104-40362010000400010-scl","Capital social e redes sociais como alternativa para análise de políticas públicas de educação: o caso de Icapuí-CE","Martins, Rafael D&#039;Almeida, Lotta, Gabriela Spanghero","Ensaio: Avaliação e Políticas Públicas em Educação; 18(69); 846-860","Ensaio: Avaliação e Políticas Públicas em Educação","Português","2010","http://www.scielo.br/scielo.php?script=sci_arttext&pid=S0104-40362010000400010&lang=pt" 
"S1679-39512010000300008-scl","A inovação no Pólo Joalheiro de Belém: uma análise a partir do mecanismo de imersão estrutural","Castro, Renato Brito de, Baldi, Mariana","Cadernos EBAPE.BR; 8(3); 492-513","Cadernos EBAPE.BR","Português","2010","http://www.scielo.br/scielo.php?script=sci_arttext&pid=S1679-39512010000300008&lang=pt" 
"S1415-65552010000600007-scl","Organizational institutionalism in the academic field in Brazil: social dynamics and networks","Guarido Filho, Edson Ronaldo, Machado-da-Silva, Clóvis L., Gonçalves, Sandro Aparecido","Revista de Administração Contemporânea; 14(spe); 149-172","Revista de Administração Contemporânea","Inglês","2010","http://www.scielo.br/scielo.php?script=sci_arttext&pid=S1415-65552010000600007&lang=pt" 
"S1415-65552010000400010-scl","Cooperação e alianças: perspectivas teóricas e suas articulações no contexto do pensamento estratégico","Vale, Gláucia Maria Vasconcellos, Lopes, Humberto Elias Garcia","Revista de Administração Contemporânea; 14(4); 722-737","Revista de Administração Contemporânea","Português","2010","http://www.scielo.br/scielo.php?script=sci_arttext&pid=S1415-65552010000400010&lang=pt" 
"S0034-76122010000300002-scl","A gestão do desenvolvimento local no Brasil: (des)articulação de atores, instrumentos e território","Martins, Rafael D&#039;Almeida, Vaz, José Carlos, Caldas, Eduardo de Lima","Revista de Administração Pública; 44(3); 559-590","Revista de Administração Pública","Português","2010","http://www.scielo.br/scielo.php?script=sci_arttext&pid=S0034-76122010000300002&lang=pt" 
"S1679-39512010000200007-scl","The development of institutional theory in the field of organization studies in Brazil","Guarido Filho, Edson Ronaldo, Machado-da-Silva, Clóvis L.","Cadernos EBAPE.BR; 8(2); 278-301","Cadernos EBAPE.BR","Inglês","2010","http://www.scielo.br/scielo.php?script=sci_arttext&pid=S1679-39512010000200007&lang=pt" 
"S1415-65552010000300005-scl","O campo de estudo sobre redes de cooperação interorganizacional no Brasil","Balestrin, Alsones, Verschoore, Jorge Renato, Reyes Junior, Edgar","Revista de Administração Contemporânea; 14(3); 458-477","Revista de Administração Contemporânea","Português","2010","http://www.scielo.br/scielo.php?script=sci_arttext&pid=S1415-65552010000300005&lang=pt" 
"S1517-45222010000100008-scl","Redes tecnossociais e democratização das políticas públicas","Egler, Tamara Tania Cohen","Sociologias; (23); 208-236","Sociologias","Português","2010","http://www.scielo.br/scielo.php?script=sci_arttext&pid=S1517-45222010000100008&lang=pt" 
